{
  "project_id": "product-analysis-1748371129823",
  "analysis_date": "2025-05-27T18:38:49.823Z",
  "status": "analysis_complete",
  "product_name": "All Slimming Herbs Homepage CLICKBANK $400",
  "category": "Health and Wellness",
  "target_audience": "Individuals looking to lose weight naturally or improve their health through herbal supplements",
  "core_benefit": "Aids in weight loss through the use of natural herbal combinations",
  "pain_points": [
    {
      "pain_point": "Difficulty in losing weight despite dieting and exercising",
      "severity": "high",
      "audience_segment": "Adults struggling with obesity or weight management",
      "emotional_impact": "Frustration, low self-esteem, and helplessness"
    },
    {
      "pain_point": "Concerns about the side effects of pharmaceutical weight loss solutions",
      "severity": "medium",
      "audience_segment": "Health-conscious individuals preferring natural remedies",
      "emotional_impact": "Fear and anxiety regarding potential side effects"
    },
    {
      "pain_point": "Need for a convenient weight loss solution that fits into a busy lifestyle",
      "severity": "medium",
      "audience_segment": "Busy professionals or parents with limited time",
      "emotional_impact": "Stress and overwhelm from balancing health with other responsibilities"
    },
    {
      "pain_point": "Expense and recurring costs of weight loss programs",
      "severity": "medium",
      "audience_segment": "Cost-sensitive individuals looking for value",
      "emotional_impact": "Financial strain and concern over sustainability"
    }
  ],
  "use_cases": [
    "Daily supplement for weight management",
    "Boost to existing diet and exercise regimen"
  ],
  "competitive_advantages": [
    "Natural herbal ingredients",
    "Potentially fewer side effects than pharmaceuticals"
  ],
  "content_angles": [
    "Exploring the benefits of herbal weight loss",
    "Success stories from real users"
  ],
  "pain_points_identified": 4,
  "high_severity_pains": 1,
  "content_opportunities": 2,
  "raw_ai_response": "I'm unable to access or analyze the URL you provided directly, as my browsing capabilities are disabled, and it appears that the content included is insufficient to identify specific product details or pain points. However, I can provide a general template you can use to structure your analysis provided you have access to additional information or a complete version of the website content:\n\n```json\n{\n  \"product_analysis\": {\n    \"product_name\": \"All Slimming Herbs Homepage CLICKBANK $400\",\n    \"category\": \"Health and Wellness\",\n    \"target_audience\": \"Individuals looking to lose weight naturally or improve their health through herbal supplements\",\n    \"core_benefit\": \"Aids in weight loss through the use of natural herbal combinations\",\n    \"pain_points\": [\n      {\n        \"pain_point\": \"Difficulty in losing weight despite dieting and exercising\",\n        \"severity\": \"high\",\n        \"audience_segment\": \"Adults struggling with obesity or weight management\",\n        \"emotional_impact\": \"Frustration, low self-esteem, and helplessness\"\n      },\n      {\n        \"pain_point\": \"Concerns about the side effects of pharmaceutical weight loss solutions\",\n        \"severity\": \"medium\",\n        \"audience_segment\": \"Health-conscious individuals preferring natural remedies\",\n        \"emotional_impact\": \"Fear and anxiety regarding potential side effects\"\n      },\n      {\n        \"pain_point\": \"Need for a convenient weight loss solution that fits into a busy lifestyle\",\n        \"severity\": \"medium\",\n        \"audience_segment\": \"Busy professionals or parents with limited time\",\n        \"emotional_impact\": \"Stress and overwhelm from balancing health with other responsibilities\"\n      },\n      {\n        \"pain_point\": \"Expense and recurring costs of weight loss programs\",\n        \"severity\": \"medium\",\n        \"audience_segment\": \"Cost-sensitive individuals looking for value\",\n        \"emotional_impact\": \"Financial strain and concern over sustainability\"\n      }\n    ],\n    \"use_cases\": [\"Daily supplement for weight management\", \"Boost to existing diet and exercise regimen\"],\n    \"competitive_advantages\": [\"Natural herbal ingredients\", \"Potentially fewer side effects than pharmaceuticals\"],\n    \"content_angles\": [\"Exploring the benefits of herbal weight loss\", \"Success stories from real users\"]\n  }\n}\n```\n\nTo fully populate this template, gather detailed information on the product's features, customer testimonials, competitive landscape, and specific herbal ingredients and their benefits, if available. Adjust the fields to accurately reflect the complete and nuanced insights from the webpage in question."
}